{
  "schema_version": "1.1",
  "generated_at": "2026-09-13T17:44:48.714078+00:00",
  "jurisdiction": "US",
  "coverage": "covered",
  "statement": "The last run covering US (072bc26bf44247b5af57af754b6ad5d2, failed) read 0 of 6 registered source(s) in this jurisdiction, and held 0 of those readings against the committed baseline. For the other 6, this run is not evidence that nothing changed.",
  "outcome_vocabulary": {
    "observed_unchanged": "The last covering run read this page, held it against the committed baseline, and they matched.",
    "observed_changed": "The last covering run read this page and it differed from the committed baseline; the difference is in the review queue, and appears in a feed only once a human has confirmed it.",
    "observed_unbaselined": "The last covering run read this page for the first time. There was no committed baseline to hold it against, so this fetch BECAME the baseline and nothing was compared. Not evidence of no change \u2014 come back after the next run.",
    "observed_rebaselined": "The registry now points this source at a different page than the one the baseline was taken from, so the last covering run refused the comparison and re-baselined on what it fetched. Nothing was compared. Whatever the old page did is no longer being watched under this entry.",
    "observed_unrenormalizable": "The last covering run read this page, and the committed baseline is not re-derivable under today's normalization contract, so there was nothing comparable to hold it against. Nothing was compared. This one needs an operator, not another run.",
    "observed_comparison_unknown": "The run read this page but did not record whether it was held against a baseline. Rows written before comparison outcomes were persisted read this way. It is not a report that nothing changed; it is the absence of a report.",
    "unreachable": "The last covering run tried to fetch this page and did not get one. Nothing about this source was compared, so this run is not evidence that it did not change.",
    "unreadable": "The last covering run fetched this page and it yielded no extractable text, so there was nothing to compare against the baseline. Not evidence of no change.",
    "not_eligible": "The last covering run considered this source and did not attempt it \u2014 see the recorded eligibility reasons.",
    "not_attempted": "The last covering run did not attempt this source. Where there is no run at all, every source reads this way.",
    "in_flight": "The last covering run has not recorded an outcome for this source. It is running, or it ended without answering for this one.",
    "outcome_unknown": "The run recorded a retrieval for this source but not what was observed. Receipts written before observation outcomes were persisted read this way.",
    "not_in_run": "This source was not in the last covering run at all \u2014 it is newer than that run, or it was outside its scope."
  },
  "run": {
    "run_id": "072bc26bf44247b5af57af754b6ad5d2",
    "state": "failed",
    "scope": "all jurisdictions",
    "as_of": "2026-08-29",
    "started_at": "2026-08-29T17:00:52.463546+00:00",
    "completed_at": "2026-08-29T17:00:52.466137+00:00"
  },
  "latest_run": {
    "run_id": "072bc26bf44247b5af57af754b6ad5d2",
    "state": "failed",
    "scope": "all jurisdictions",
    "as_of": "2026-08-29",
    "started_at": "2026-08-29T17:00:52.463546+00:00",
    "completed_at": "2026-08-29T17:00:52.466137+00:00"
  },
  "counts": {
    "observed_unchanged": 0,
    "observed_changed": 0,
    "observed_unbaselined": 0,
    "observed_rebaselined": 0,
    "observed_unrenormalizable": 0,
    "observed_comparison_unknown": 0,
    "unreachable": 0,
    "unreadable": 0,
    "not_eligible": 6,
    "not_attempted": 0,
    "in_flight": 0,
    "outcome_unknown": 0,
    "not_in_run": 0
  },
  "sources": [
    {
      "source_id": "us-federal-register-sex-marker",
      "jurisdiction": "US",
      "document_class": "passport",
      "url": "https://www.federalregister.gov/api/v1/documents.json?conditions%5Bterm%5D=passport+sex+marker&order=newest&per_page=20&fields%5B%5D=title&fields%5B%5D=publication_date&fields%5B%5D=document_number&fields%5B%5D=html_url&fields%5B%5D=agencies",
      "authority": "Office of the Federal Register (National Archives)",
      "verification_status": "unverified",
      "human_verified": false,
      "verified_by": "",
      "verified_at": "",
      "verification_statement": "UNVERIFIED \u2014 machine-checked, not human-confirmed. A live fetch confirmed this URL answers and its title was read; NO HUMAN has confirmed that it is the official page for this document class in this jurisdiction. Do not rely on it as authoritative guidance.",
      "eligible_in_run": false,
      "eligibility_reasons": [
        "unverified",
        "fetch-policy-unreviewed"
      ],
      "outcome": "not_eligible",
      "outcome_statement": "The last covering run considered this source and did not attempt it \u2014 see the recorded eligibility reasons."
    },
    {
      "source_id": "us-passport-change-correct",
      "jurisdiction": "US",
      "document_class": "passport",
      "url": "https://travel.state.gov/content/travel/en/passports/have-passport/change-correct.html",
      "authority": "U.S. Department of State, Bureau of Consular Affairs",
      "verification_status": "unverified",
      "human_verified": false,
      "verified_by": "",
      "verified_at": "",
      "verification_statement": "UNVERIFIED \u2014 machine-checked, not human-confirmed. A live fetch confirmed this URL answers and its title was read; NO HUMAN has confirmed that it is the official page for this document class in this jurisdiction. Do not rely on it as authoritative guidance.",
      "eligible_in_run": false,
      "eligibility_reasons": [
        "unverified",
        "fetch-policy-unreviewed"
      ],
      "outcome": "not_eligible",
      "outcome_statement": "The last covering run considered this source and did not attempt it \u2014 see the recorded eligibility reasons."
    },
    {
      "source_id": "us-passport-sex-markers",
      "jurisdiction": "US",
      "document_class": "passport",
      "url": "https://travel.state.gov/en/passports/apply/unique-needs/sex-markers.html",
      "authority": "U.S. Department of State, Bureau of Consular Affairs",
      "verification_status": "unverified",
      "human_verified": false,
      "verified_by": "",
      "verified_at": "",
      "verification_statement": "UNVERIFIED \u2014 machine-checked, not human-confirmed. A live fetch confirmed this URL answers and its title was read; NO HUMAN has confirmed that it is the official page for this document class in this jurisdiction. Do not rely on it as authoritative guidance.",
      "eligible_in_run": false,
      "eligibility_reasons": [
        "unverified",
        "fetch-policy-unreviewed"
      ],
      "outcome": "not_eligible",
      "outcome_statement": "The last covering run considered this source and did not attempt it \u2014 see the recorded eligibility reasons."
    },
    {
      "source_id": "us-selective-service-register",
      "jurisdiction": "US",
      "document_class": "selective_service",
      "url": "https://www.sss.gov/register/",
      "authority": "U.S. Selective Service System",
      "verification_status": "unverified",
      "human_verified": false,
      "verified_by": "",
      "verified_at": "",
      "verification_statement": "UNVERIFIED \u2014 machine-checked, not human-confirmed. A live fetch confirmed this URL answers and its title was read; NO HUMAN has confirmed that it is the official page for this document class in this jurisdiction. Do not rely on it as authoritative guidance.",
      "eligible_in_run": false,
      "eligibility_reasons": [
        "unverified",
        "fetch-policy-unreviewed"
      ],
      "outcome": "not_eligible",
      "outcome_statement": "The last covering run considered this source and did not attempt it \u2014 see the recorded eligibility reasons."
    },
    {
      "source_id": "us-ssa-number-card",
      "jurisdiction": "US",
      "document_class": "social_security",
      "url": "https://www.ssa.gov/number-card",
      "authority": "U.S. Social Security Administration",
      "verification_status": "unverified",
      "human_verified": false,
      "verified_by": "",
      "verified_at": "",
      "verification_statement": "UNVERIFIED \u2014 machine-checked, not human-confirmed. A live fetch confirmed this URL answers and its title was read; NO HUMAN has confirmed that it is the official page for this document class in this jurisdiction. Do not rely on it as authoritative guidance.",
      "eligible_in_run": false,
      "eligibility_reasons": [
        "unverified",
        "fetch-policy-unreviewed"
      ],
      "outcome": "not_eligible",
      "outcome_statement": "The last covering run considered this source and did not attempt it \u2014 see the recorded eligibility reasons."
    },
    {
      "source_id": "us-ssa-ss5-form",
      "jurisdiction": "US",
      "document_class": "social_security",
      "url": "https://www.ssa.gov/forms/ss-5.pdf",
      "authority": "U.S. Social Security Administration",
      "verification_status": "unverified",
      "human_verified": false,
      "verified_by": "",
      "verified_at": "",
      "verification_statement": "UNVERIFIED \u2014 machine-checked, not human-confirmed. A live fetch confirmed this URL answers and its title was read; NO HUMAN has confirmed that it is the official page for this document class in this jurisdiction. Do not rely on it as authoritative guidance.",
      "eligible_in_run": false,
      "eligibility_reasons": [
        "unverified",
        "fetch-policy-unreviewed"
      ],
      "outcome": "not_eligible",
      "outcome_statement": "The last covering run considered this source and did not attempt it \u2014 see the recorded eligibility reasons."
    }
  ]
}
